,scene_id,scene_text,in_summary,aspects,dialogue,non_dialogue,annihilate,annihilation,asphyxiate,assassin,assassinate,assassination,behead,beheading,blood-bath,bloodshed,butcher,butchery,carnage,crucifixion,crucify,deadly,decapitate,decapitation,destroy,dispatch,do in,drown,eliminate,euthanasia,euthanize,exterminate,extermination,fatal,fatality,fratricide,garrotte,genocide,holocaust,homicide,immolation,infanticide,kill,killer,killing,lethal,liquidate,liquidation,liquidator,lynch,massacre,matricide,murder,murderer,patricide,pogrom,regicide,shooting,silence,slaughter,slaughterer,slay,slayer,slaying,smother,smothering,starve,suffocate,suffocation,suicide,take (someone)life,take out,terminate,centrality,prediction_class,score,combined_score
23,23,"[' ( CATHERINE fills GRISSOM in on her theory . )', ' [[Catherine]] the sperm found in the condom was frozen at 10:15 a.m', "" [[Catherine]] it 's all heads , no tails"", "" [[Grissom]] i 'm not quite up to speed on the particulars of"", ' [[Catherine]] it takes about seven hours for bacteria to eat away at the tails placing the time of ejaculation at around 2:00 a.m', "" [[Catherine]] but kristy 's time of death was 6:00 a.m"", "" [[Grissom]] well , it suggests a lag between ejaculation and kristy 's murder but it does n't disprove nick 's presence at the time of the homicide"", ' [[Catherine]] you could be a little more supportive', ' ( CATHERINE walks away . )', ' ( SARA walks out of a nearby lab . )', ' [[Sara]] i have a new favorite color', ' [[Grissom]] orange ?', ' [[Sara]] the orange polyester from the bomb is a match to the thrift-right jacket', ' [[Sara]] guess where their regional headquarters is located', ' [[Grissom]] the hansen building', ' [[Sara]] you bet', ' [[Sara]] i ran a lexis search looking for disgruntled employees , irate customers anyone with a grievance against thrift-right', ' [[Grissom]] you get any hits ?', ' [[Sara]] norman stirling -- former manager', ' [[Grissom]] how disgruntled ?', ' [[Sara]] let go last year', ' [[Sara]] caused a commotion at hq', ' [[Sara]] filed lawsuits against the company', "" [[Sara]] guy 's been out of work ever since"", ' ( SARA turns and heads back to the lab . )', ' [[Grissom]] sitting around making bombs']",0,None,"['[[Catherine]] the sperm found in the condom was frozen at 10:15 a.m\', "" [[Catherine]] it \'s all heads , no tails"",', '[[Grissom]] i \'m not quite up to speed on the particulars of"",', '[[Catherine]] it takes about seven hours for bacteria to eat away at the tails placing the time of ejaculation at around 2:00 a.m\', "" [[Catherine]] but kristy \'s time of death was 6:00 a.m"",', '[[Grissom]] well , it suggests a lag between ejaculation and kristy \'s murder but it does n\'t disprove nick \'s presence at the time of the homicide"",', '[[Catherine]] you could be a little more supportive\', \' ( CATHERINE walks away . )\', \' ( SARA walks out of a nearby lab . )\', \' [[Sara]] i have a new favorite color\', \' [[Grissom]] orange ?\', \' [[Sara]] the orange polyester from the bomb is a match to the thrift-right jacket\', \' [[Sara]] guess where their regional headquarters is located\', \' [[Grissom]] the hansen building\', \' [[Sara]] you bet\', \' [[Sara]] i ran a lexis search looking for disgruntled employees , irate customers anyone with a grievance against thrift-right\', \' [[Grissom]] you get any hits ?\', \' [[Sara]] norman stirling -- former manager\', \' [[Grissom]] how disgruntled ?\', \' [[Sara]] let go last year\', \' [[Sara]] caused a commotion at hq\', \' [[Sara]] filed lawsuits against the company\', "" [[Sara]] guy \'s been out of work ever since"",']","[' ( CATHERINE fills GRISSOM in on her theory . )', '    '    '  ' ( SARA turns and heads back to the lab . )', ' [[Grissom]] sitting around making bombs']",0.11848122626543045,0.1749400645494461,0.2903788983821869,0.2607801854610443,0.3221246302127838,0.4202491044998169,0.24991475045681,0.16398407518863678,0.318098783493042,0.7618259787559509,0.1985035389661789,0.6824807524681091,0.22498832643032074,0.14392352104187012,0.31191080808639526,0.4605761766433716,0.208208367228508,0.15644335746765137,0.4203934371471405,0.41482239961624146,0.7310353517532349,0.22523440420627594,0.14730416238307953,0.16324634850025177,0.09661559015512466,0.1746625155210495,0.30380094051361084,0.3388056457042694,0.7594432234764099,0.488664835691452,0.271989107131958,0.07081823796033859,0.10853331536054611,0.9305958151817322,0.1713906079530716,0.2033739686012268,0.7054671049118042,0.5033693909645081,0.8501800894737244,0.4404584467411041,0.3406313955783844,0.30370405316352844,0.4316549003124237,0.2421799898147583,0.14787247776985168,0.7117319107055664,0.8091813921928406,0.5559635758399963,0.5762795805931091,0.30381539463996887,0.3571345806121826,0.39198100566864014,0.04361618682742119,0.2500898540019989,0.5705485343933105,0.5412232279777527,0.4533785283565521,0.6669440269470215,0.4242139458656311,0.43470820784568787,0.3916262984275818,0.26759013533592224,0.26026052236557007,0.05251016840338707,0.5551139116287231,0.42926025390625,0.529996931552887,0.6560354335359527,0,0.8371089317852634,0.8371089317852634
20,20,"[' ( The jail door slides open . )', "" [[Grissom]] you 're free to go"", ' [[Grissom]] i wanted to tell you in person', "" [[Dominic_Kretzker]] you mean you were n't just in the neighborhood ?"", ' ( They both walk slowly toward the door . )', "" [[Dominic_Kretzker]] that second bomb -- it was n't remote , was it ?"", "" [[Dominic_Kretzker]] otherwise , i 'd still be a suspect"", "" [[Grissom]] i ca n't discuss it"", "" [[Dominic_Kretzker]] so i guess you 're not going to be needing my expertise anymore"", ' [[Dominic_Kretzker]] i mean , investigation-wise', ' [[Dominic_Kretzker]] i knew it was too good to be true', ' ( DOMINIC turns to GRISSOM and salutes him . )', ' [[Dominic_Kretzker]] well , proud to have worked with you , sir', ' [[Grissom]] dominic', "" [[Grissom]] i 'm not a police officer"", "" [[Grissom]] i-i-i 'm a crime scene analyst"", "" [[Dominic_Kretzker]] yeah , but we know who really solves the crimes , do n't we , sir ?"", ' ( They shake hands . )', ' [[Grissom]] good luck', ' [[Grissom]] take care of yourself', ' [[Dominic_Kretzker]] thank you', ' ( GRISSOM turns to leave . )', ' ( He stops and turns back around . )', ' [[Grissom]] hey , dom ?', ' [[Dominic_Kretzker]] yeah ?', ' [[Grissom]] next time try not to be quite so trusting', "" [[Grissom]] you do n't need to be a hero"", ' ( GRISSOM leaves the room . )']",0,None,"['[[Grissom]] you \'re free to go"",', '[[Grissom]] i wanted to tell you in person\', "" [[Dominic_Kretzker]] you mean you were n\'t just in the neighborhood ?"",', '[[Dominic_Kretzker]] that second bomb -- it was n\'t remote , was it ?"",', '[[Dominic_Kretzker]] otherwise , i \'d still be a suspect"",', '[[Grissom]] i ca n\'t discuss it"",', '[[Dominic_Kretzker]] so i guess you \'re not going to be needing my expertise anymore"",', '[[Dominic_Kretzker]] i mean , investigation-wise\', \' [[Dominic_Kretzker]] i knew it was too good to be true\', \' ( DOMINIC turns to GRISSOM and salutes him . )\', \' [[Dominic_Kretzker]] well , proud to have worked with you , sir\', \' [[Grissom]] dominic\', "" [[Grissom]] i \'m not a police officer"",', '[[Grissom]] i-i-i \'m a crime scene analyst"",', '[[Dominic_Kretzker]] yeah , but we know who really solves the crimes , do n\'t we , sir ?"",', '[[Grissom]] good luck\', \' [[Grissom]] take care of yourself\', \' [[Dominic_Kretzker]] thank you\', \' ( GRISSOM turns to leave . )\', \' ( He stops and turns back around . )\', \' [[Grissom]] hey , dom ?\', \' [[Dominic_Kretzker]] yeah ?\', \' [[Grissom]] next time try not to be quite so trusting\', "" [[Grissom]] you do n\'t need to be a hero"",']","[' ( The jail door slides open . )',   '  ' ( They both walk slowly toward the door . )',         '      ' ( They shake hands . )', '  ' ( GRISSOM leaves the room . )']",0.06387175619602203,0.2699264585971832,0.16061602532863617,0.2841040790081024,0.37828686833381653,0.4460444748401642,0.03013552725315094,0.0482962541282177,0.30475249886512756,0.7139697074890137,0.17935222387313843,0.36577969789505005,0.6061428785324097,0.10879331827163696,0.3389754295349121,0.5525937080383301,0.08887073397636414,0.2574564218521118,0.5030016303062439,0.7241719961166382,0.7642518877983093,0.14098168909549713,0.8349505066871643,0.06350688636302948,0.08098000288009644,0.08467579632997513,0.2624547481536865,0.297965407371521,0.3152865171432495,0.43722468614578247,0.27287980914115906,0.10857264697551727,0.18269778788089752,0.5414186120033264,0.382700115442276,0.2736051082611084,0.40498441457748413,0.5575451254844666,0.5810226202011108,0.5288529396057129,0.40153759717941284,0.4829755127429962,0.15908218920230865,0.12148072570562363,0.28715550899505615,0.29934564232826233,0.4277024269104004,0.2553826570510864,0.26833656430244446,0.4270044267177582,0.2712053656578064,0.37572261691093445,0.02272755280137062,0.25856369733810425,0.5330163240432739,0.4759771227836609,0.41635778546333313,0.3341980576515198,0.4946390688419342,0.8976448178291321,0.24863971769809723,0.22147290408611298,0.24764293432235718,0.029170244932174683,0.6318413615226746,0.4590969979763031,0.9240437150001526,0.5427408907959034,0,0.8209903859999184,0.8209903859999184
28,28,"["" ( WARRICK continues to look at the 'FP ' etching on the gear piece . )"", ' ( GRISSOM walks in )', ' [[Grissom]] dispatch said you were looking for me ?', ' [[Warrick]] yeah', "" [[Warrick]] i finally matched this 'fp ' to this electric etcher"", ' [[Warrick]] now , i made an exemplar', ' [[Warrick]] boom !', ' [[Warrick]] identical type of striations', ' [[Warrick]] the manufacturer says that this etcher is only used for training purposes', "" [[Warrick]] and it 's only sold in bulk"", ' [[Warrick]] it was not sold to norman stirling', ' [[Grissom]] so who bought it ?', ' [[Warrick]] las vegas school district', ' [[Warrick]] i called the district , and we traced it down to one high school -- summit high', ' ( GRISSOM looks at the paper . )', "" [[Warrick]] stirling 's son goes there"", ' ( GRISSOM looks at WARRICK . )']",0,None,"['[[Grissom]] dispatch said you were looking for me ?\', \' [[Warrick]] yeah\', "" [[Warrick]] i finally matched this \'fp \' to this electric etcher"",', '[[Warrick]] now , i made an exemplar\', \' [[Warrick]] boom !\', \' [[Warrick]] identical type of striations\', \' [[Warrick]] the manufacturer says that this etcher is only used for training purposes\', "" [[Warrick]] and it \'s only sold in bulk"",', '[[Warrick]] it was not sold to norman stirling\', \' [[Grissom]] so who bought it ?\', \' [[Warrick]] las vegas school district\', \' [[Warrick]] i called the district , and we traced it down to one high school -- summit high\', \' ( GRISSOM looks at the paper . )\', "" [[Warrick]] stirling \'s son goes there"",']","[ ( WARRICK continues to look at the 'FP ' etching on the gear piece . ), ' ( GRISSOM walks in )', '  '  '  ' ( GRISSOM looks at WARRICK . )']",0.023630158975720406,0.028170358389616013,0.02597871422767639,0.014380814507603645,0.02207903191447258,0.016664566472172737,0.05564510077238083,0.018489498645067215,0.020909346640110016,0.015616590157151222,0.009390067309141159,0.04950406029820442,0.0221363864839077,0.04681483283638954,0.053119201213121414,0.06585156917572021,0.010799093171954155,0.0267155971378088,0.016618166118860245,0.9153271913528442,0.619293212890625,0.015779441222548485,0.014263437129557133,0.0037279047537595034,0.0028120665811002254,0.007303317077457905,0.01669463701546192,0.010328233242034912,0.004158537834882736,0.05009793862700462,0.12401092052459717,0.0014901859685778618,0.012551023624837399,0.005983287002891302,0.04060261324048042,0.003030111314728856,0.0968049094080925,0.6991784572601318,0.026947103440761566,0.08631300181150436,0.08087368309497833,0.06917928904294968,0.12989851832389832,0.07161903381347656,0.0023635595571249723,0.038454003632068634,0.002452090848237276,0.0018031372455880046,0.05186057090759277,0.041266921907663345,0.016584675759077072,0.44073110818862915,0.00040831489604897797,0.004016504622995853,0.1563837081193924,0.13112807273864746,0.20691604912281036,0.07824017107486725,0.16806288063526154,0.07636166363954544,0.02542046457529068,0.004286520648747683,0.012138701975345612,0.0010173984337598085,0.1488424837589264,0.15538716316223145,0.0847163051366806,0.7181010839534702,0,0.7995472331779925,0.7995472331779925
19,19,"[' ( Emergency personnel are all over the parking lot area in the rain BRASS fills in everyone on what they know . )', ' [[Brass]] so , the manager was working the lot when he heard the blast', ' [[Brass]] fatality was on the check-in line and died on the way to the hospital', ' [[Sara]] anybody report hearing any noise ?', ' [[Sara]] ticking ?', ' [[Brass]] no', ' [[Brass]] no one heard anything', ' [[Sara]] oh', "" [[Sara]] it 's not the firemen -- it 's the rain this crime scene is trashed"", ' ( GRISSOM look down on the ground and picks up something . )', ' [[Sara]] what do you have ?', ' [[Grissom]] form follows function', "" [[Grissom]] they 've never been able to make a better one"", ' [[Grissom]] mousetrap', ' [[Sara]] that orange stuff again', ' [[Grissom]] someone picks it up motion trips the trap , sets off the timer', ' ( Quick CGI POV of the trap tripping , the timer sending the spark through the wire . )', ' ( The bomb detonates . )', ' [[Sara]] which sets off the bomb', ' ( It explodes . )', ' ( End of CGI POV . )', ' ( Resume to present . )', ' ( SARA looks around the parking lot , then notices the MANAGER speaking with an OFFICER . )', ' ( She sees something . )', ' [[Sara]] be right back', ' ( SARA leaves and heads toward them . )', ' ( GRISSOM turns to BRASS . )', ' [[Grissom]] we say nothing to the media or anybody', "" [[Grissom]] our bomber 's signature just got a little more sophisticated"", ' ( SARA walks up to the MANAGER . )', ' [[Sara]] excuse me', ' [[Sara]] hi', "" [[Sara]] i 'm with the crime lab"", "" [[Sara]] i 'm sorry , but i have to take your jacket"", ' ( The MANAGER looks down at his orange jacket , then takes it off . )', ' [[Manager]] um ... okay', "" [[Manager]] if it 'll help"", ' ( He gives the jacket to SARA . )', ' [[Sara]] thanks', ' ( The officer leads the MANAGER off to another direction . )', "" [[Officer]] let 's go"", ' [[Manager]] okay', ' ( GRISSOM and BRASS join SARA . )', ' [[Grissom]] what are you doing ?', ' [[Sara]] polyethylene-terephtalete', ' ( SARA gathers up the jacket . )', ' [[Grissom]] polyester', "" [[Sara]] 'orange stuff '"", ' ( She turns and walks away . )']",1,"Crime scene,Evidence","['[[Brass]] so , the manager was working the lot when he heard the blast\', \' [[Brass]] fatality was on the check-in line and died on the way to the hospital\', \' [[Sara]] anybody report hearing any noise ?\', \' [[Sara]] ticking ?\', \' [[Brass]] no\', \' [[Brass]] no one heard anything\', \' [[Sara]] oh\', "" [[Sara]] it \'s not the firemen -- it \'s the rain this crime scene is trashed"",', '[[Sara]] what do you have ?\', \' [[Grissom]] form follows function\', "" [[Grissom]] they \'ve never been able to make a better one"",', '[[Grissom]] mousetrap\', \' [[Sara]] that orange stuff again\', \' [[Grissom]] someone picks it up motion trips the trap , sets off the timer\', \' ( Quick CGI POV of the trap tripping , the timer sending the spark through the wire . )\', \' ( The bomb detonates . )\', \' [[Sara]] which sets off the bomb\', \' ( It explodes . )\', \' ( End of CGI POV . )\', \' ( Resume to present . )\', \' ( SARA looks around the parking lot , then notices the MANAGER speaking with an OFFICER . )\', \' ( She sees something . )\', \' [[Sara]] be right back\', \' ( SARA leaves and heads toward them . )\', \' ( GRISSOM turns to BRASS . )\', \' [[Grissom]] we say nothing to the media or anybody\', "" [[Grissom]] our bomber \'s signature just got a little more sophisticated"",', '[[Sara]] excuse me\', \' [[Sara]] hi\', "" [[Sara]] i \'m with the crime lab"",', '[[Sara]] i \'m sorry , but i have to take your jacket"",', '[[Manager]] um ... okay\', "" [[Manager]] if it \'ll help"",', '[[Sara]] thanks\', \' ( The officer leads the MANAGER off to another direction . )\', "" [[Officer]] let \'s go"",', '[[Manager]] okay\', \' ( GRISSOM and BRASS join SARA . )\', \' [[Grissom]] what are you doing ?\', \' [[Sara]] polyethylene-terephtalete\', \' ( SARA gathers up the jacket . )\', \' [[Grissom]] polyester\', "" [[Sara]] \'orange stuff \'"",']","[' ( Emergency personnel are all over the parking lot area in the rain BRASS fills in everyone on what they know . )', '  ' ( GRISSOM look down on the ground and picks up something . )', '  '  ' ( SARA walks up to the MANAGER . )', '    ' ( The MANAGER looks down at his orange jacket , then takes it off . )', '  ' ( He gives the jacket to SARA . )', '  '  ' ( She turns and walks away . )']",0.3753778338432312,0.432527631521225,0.4242760241031647,0.3136686086654663,0.29695767164230347,0.48694077134132385,0.02537797950208187,0.029745327308773994,0.4365396499633789,0.9148051142692566,0.159200519323349,0.28460195660591125,0.7938781380653381,0.020869974046945572,0.10244634747505188,0.8561580181121826,0.09820439666509628,0.1676410734653473,0.6409770846366882,0.503592312335968,0.6292999982833862,0.09210264682769775,0.1639675498008728,0.0891713798046112,0.12967146933078766,0.1630180925130844,0.45029616355895996,0.7659789323806763,0.8225412368774414,0.632790207862854,0.14682398736476898,0.05953593552112579,0.13019202649593353,0.7891611456871033,0.6288687586784363,0.14422494173049927,0.5798699259757996,0.8600250482559204,0.8208115100860596,0.8207290172576904,0.1202881783246994,0.1465233713388443,0.21222691237926483,0.10248930752277374,0.1424427479505539,0.3779009282588959,0.6389785408973694,0.3396274149417877,0.4491533637046814,0.5476991534233093,0.3936186134815216,0.3838871121406555,0.020986121147871017,0.34886062145233154,0.48602294921875,0.48655158281326294,0.2626285254955292,0.230209082365036,0.2425309419631958,0.3262397348880768,0.2422586977481842,0.25425198674201965,0.20305772125720978,0.021416060626506805,0.8160200715065002,0.41952383518218994,0.1277894377708435,0.5595233727992871,0,0.7982628933263305,0.7982628933263305
11,11,"[' ( GRISSOM sits behind his desk . )', ' ( He sighs . )', "" [[Grissom]] you told me you were n't dating her"", "" [[Nick]] i was n't till last night after i broke up her fight with this guy , uh ... jack"", "" [[Grissom]] and ecklie 's at her house now"", "" [[Nick]] yeah , and i can tell you what he 's going to find"", ' [[Nick]] my fingerprints ; my dna', ' [[Grissom]] what were you thinking , nicky ?', "" [[Nick]] i was n't"", ' ( Quick flashback to : That night , KRISTY leans toward NICK and kisses him . )', ' [[Nick]] we had a connection , you know ?', ' [[Nick]] a chemistry thing , i guess', ' ( White flash to : NICK and KRISTY are in bed kissing . )', ' [[Nick]] she was irresistible , man', ' ( End of flashback . )', ' ( Resume to present . )', ' [[Nick]] i took off around four', "" [[Grissom]] ecklie 's going to be all over this"", ' ( CATHERINE knocks lightly on the door and walks into the office . )', ' [[Catherine]] hey , nick', "" [[Catherine]] i 'm sorry to hear about your friend"", ' ( She puts a reassuring hand on his shoulder . )', ' [[Nick]] who told you ?', ' [[Catherine]] word travels', ' [[Catherine]] it was the day shift coroner', ' [[Nick]] so people know i was with kristy last night ?', ' [[Catherine]] not yet', ' [[Nick]] maybe i should just go to ecklie and tell him i was there', "" [[Grissom]] when you 're a suspect and you 're innocent , keep your mouth shut"", "" [[Grissom]] i 'll talk to ecklie"", ' [[Catherine]] bad idea', ' [[Catherine]] you and ecklie ... oil and water', ' [[Catherine]] just let me get into it', ' ( NICK stands up . )', "" [[Nick]] i ca n't just sit here"", ' [[Grissom]] okay , go for a walk', "" [[Grissom]] maybe you 'll accidentally bump into your guy , 'jack ?"", ' [[Nick]] yeah', ' ( NICK gets it . )', ' ( He turns to leave the office . )', ' [[Grissom]] i.d', "" [[Grissom]] him , but do n't approach him"", ' ( NICK turns around to look at GRISSOM . )', ' [[Nick]] okay', ' ( He shakes his head , then leaves the office . )', "" [[Catherine]] if nick 's arrested"", "" [[Catherine]] it 's not going to matter that he 's cleared later"", ' ( CATHERINE sits down . )', ' [[Grissom]] no', "" [[Grissom]] it 's an automatic dismissal"", ' ( She leans back and sighs . )']",0,None,"['[[Grissom]] you told me you were n\'t dating her"",', '[[Nick]] i was n\'t till last night after i broke up her fight with this guy , uh ... jack"",', '[[Grissom]] and ecklie \'s at her house now"",', '[[Nick]] yeah , and i can tell you what he \'s going to find"",', '[[Nick]] my fingerprints ; my dna\', \' [[Grissom]] what were you thinking , nicky ?\', "" [[Nick]] i was n\'t"",', '[[Nick]] we had a connection , you know ?\', \' [[Nick]] a chemistry thing , i guess\', \' ( White flash to : NICK and KRISTY are in bed kissing . )\', \' [[Nick]] she was irresistible , man\', \' ( End of flashback . )\', \' ( Resume to present . )\', \' [[Nick]] i took off around four\', "" [[Grissom]] ecklie \'s going to be all over this"",', '[[Catherine]] hey , nick\', "" [[Catherine]] i \'m sorry to hear about your friend"",', '[[Nick]] who told you ?\', \' [[Catherine]] word travels\', \' [[Catherine]] it was the day shift coroner\', \' [[Nick]] so people know i was with kristy last night ?\', \' [[Catherine]] not yet\', \' [[Nick]] maybe i should just go to ecklie and tell him i was there\', "" [[Grissom]] when you \'re a suspect and you \'re innocent , keep your mouth shut"",', '[[Grissom]] i \'ll talk to ecklie"",', '[[Catherine]] bad idea\', \' [[Catherine]] you and ecklie ... oil and water\', \' [[Catherine]] just let me get into it\', \' ( NICK stands up . )\', "" [[Nick]] i ca n\'t just sit here"",', '[[Grissom]] okay , go for a walk\', "" [[Grissom]] maybe you \'ll accidentally bump into your guy , \'jack ?"",', '[[Nick]] yeah\', \' ( NICK gets it . )\', \' ( He turns to leave the office . )\', \' [[Grissom]] i.d\', "" [[Grissom]] him , but do n\'t approach him"",', '[[Nick]] okay\', \' ( He shakes his head , then leaves the office . )\', "" [[Catherine]] if nick \'s arrested"",', '[[Catherine]] it \'s not going to matter that he \'s cleared later"",', '[[Grissom]] no\', "" [[Grissom]] it \'s an automatic dismissal"",']","[' ( GRISSOM sits behind his desk . )', ' ( He sighs . )',         '  ' ( Quick flashback to : That night , KRISTY leans toward NICK and kisses him . )', '  ' ( CATHERINE knocks lightly on the door and walks into the office . )', '  ' ( She puts a reassuring hand on his shoulder . )', '    '  '  '  ' ( NICK turns around to look at GRISSOM . )', '    ' ( CATHERINE sits down . )', '  ' ( She leans back and sighs . )']",0.08095115423202515,0.29734566807746887,0.3609135150909424,0.3126917779445648,0.2141813039779663,0.21343152225017548,0.08079018443822861,0.03954146057367325,0.2597488760948181,0.207333043217659,0.20001573860645294,0.2976783215999603,0.23088622093200684,0.14759652316570282,0.4087502360343933,0.47803357243537903,0.03938122093677521,0.1342102438211441,0.5602074265480042,0.500143826007843,0.8943036794662476,0.344485342502594,0.494274765253067,0.06672845780849457,0.09020434319972992,0.14522764086723328,0.2135511040687561,0.47741755843162537,0.5216571092605591,0.37947148084640503,0.23493556678295135,0.0424225777387619,0.059500839561223984,0.45154282450675964,0.13722606003284454,0.1873050481081009,0.47563880681991577,0.7881074547767639,0.5108739137649536,0.4584791362285614,0.3134686350822449,0.4010816216468811,0.5232133269309998,0.1547609120607376,0.068369559943676,0.21471932530403137,0.4813723862171173,0.3165396749973297,0.29490596055984497,0.4767884612083435,0.16243746876716614,0.5075890421867371,0.3285546898841858,0.07361603528261185,0.5727124810218811,0.4485529959201813,0.4327676296234131,0.3211362361907959,0.5685465335845947,0.7966705560684204,0.356154203414917,0.3799284100532532,0.2418326735496521,0.06322351098060608,0.8432552814483643,0.7079073190689087,0.6309009194374084,0.345069908217173,0,0.7478281767652817,0.7478281767652817
