,scene_id,scene_text,in_summary,aspects,dialogue,non_dialogue,annihilate,annihilation,asphyxiate,assassin,assassinate,assassination,behead,beheading,blood-bath,bloodshed,butcher,butchery,carnage,crucifixion,crucify,deadly,decapitate,decapitation,destroy,dispatch,do in,drown,eliminate,euthanasia,euthanize,exterminate,extermination,fatal,fatality,fratricide,garrotte,genocide,holocaust,homicide,immolation,infanticide,kill,killer,killing,lethal,liquidate,liquidation,liquidator,lynch,massacre,matricide,murder,murderer,patricide,pogrom,regicide,shooting,silence,slaughter,slaughterer,slay,slayer,slaying,smother,smothering,starve,suffocate,suffocation,suicide,take (someone)life,take out,terminate,centrality,prediction_class,score,combined_score
16,16,"[' ( SARA puts a sample of the orange melted stuff in a tube and tests it . )', ' ( The printer prints out the results . )', ' ( She looks at it . )', ' ( It reads: )', ' [[Sara]] polyethylene ?', ' [[Sara]] terephtalete ?']",0,None,no dialogue,"[' ( SARA puts a sample of the orange melted stuff in a tube and tests it . )', ' ( The printer prints out the results . )', ' ( She looks at it . )', ' ( It reads: )', ' [[Sara]] polyethylene ?', ' [[Sara]] terephtalete ?']",0.9218981266021729,0.748320996761322,0.5769227743148804,0.10240970551967621,0.08365186303853989,0.06177590414881706,0.033551864326000214,0.030017949640750885,0.022583315148949623,0.09757193922996521,0.16870324313640594,0.2038961499929428,0.1114552766084671,0.15992499887943268,0.09550358355045319,0.3623906373977661,0.0545530766248703,0.03803126513957977,0.45928955078125,0.9081136584281921,0.7089433670043945,0.3816887140274048,0.9968101382255554,0.1070944219827652,0.36011090874671936,0.21180561184883118,0.17642371356487274,0.5215338468551636,0.3266654908657074,0.12205476313829422,0.36769673228263855,0.052601929754018784,0.04515683278441429,0.14224793016910553,0.2158193290233612,0.08272749930620193,0.2910248041152954,0.5327884554862976,0.12463508546352386,0.4114505648612976,0.7035499215126038,0.36566758155822754,0.44280725717544556,0.18330782651901245,0.04895610734820366,0.0347151905298233,0.05608193576335907,0.04153669998049736,0.07020927220582962,0.27667734026908875,0.143809512257576,0.20583747327327728,0.9967536330223083,0.06231841444969177,0.6524645090103149,0.21680666506290436,0.24270404875278473,0.044420626014471054,0.8033747673034668,0.7431213855743408,0.2996986508369446,0.6200307011604309,0.5345301628112793,0.05770550295710564,0.07316884398460388,0.9789226055145264,0.9826071858406067,0.2575420201510945,1,1.0,1.0
3,3,"[' ( Various shots of the on-lookers . )', ' ( WARRICK crosses under the crime scene tape and starts taking pictures of the observers . )', ' ( Using a magnetic device , CATHERINE starts gathering the minute pieces of metal in the debris . )', ' ( Cut to : SARA picks up a piece of metal and looks at it . )', ' ( She bags it . )', ' ( Cut to : WARRICK looks at the damage to the lobby wall . )', ' ( The clock on the wall reads : 6:02 . )']",0,None,no dialogue,"[' ( Various shots of the on-lookers . )', ' ( WARRICK crosses under the crime scene tape and starts taking pictures of the observers . )', ' ( Using a magnetic device , CATHERINE starts gathering the minute pieces of metal in the debris . )', ' ( Cut to : SARA picks up a piece of metal and looks at it . )', ' ( She bags it . )', ' ( Cut to : WARRICK looks at the damage to the lobby wall . )', ' ( The clock on the wall reads : 6:02 . )']",0.9218981266021729,0.748320996761322,0.5769227743148804,0.10240970551967621,0.08365186303853989,0.06177590414881706,0.033551864326000214,0.030017949640750885,0.022583315148949623,0.09757193922996521,0.16870324313640594,0.2038961499929428,0.1114552766084671,0.15992499887943268,0.09550358355045319,0.3623906373977661,0.0545530766248703,0.03803126513957977,0.45928955078125,0.9081136584281921,0.7089433670043945,0.3816887140274048,0.9968101382255554,0.1070944219827652,0.36011090874671936,0.21180561184883118,0.17642371356487274,0.5215338468551636,0.3266654908657074,0.12205476313829422,0.36769673228263855,0.052601929754018784,0.04515683278441429,0.14224793016910553,0.2158193290233612,0.08272749930620193,0.2910248041152954,0.5327884554862976,0.12463508546352386,0.4114505648612976,0.7035499215126038,0.36566758155822754,0.44280725717544556,0.18330782651901245,0.04895610734820366,0.0347151905298233,0.05608193576335907,0.04153669998049736,0.07020927220582962,0.27667734026908875,0.143809512257576,0.20583747327327728,0.9967536330223083,0.06231841444969177,0.6524645090103149,0.21680666506290436,0.24270404875278473,0.044420626014471054,0.8033747673034668,0.7431213855743408,0.2996986508369446,0.6200307011604309,0.5345301628112793,0.05770550295710564,0.07316884398460388,0.9789226055145264,0.9826071858406067,0.007250728901241343,1,1.0,1.0
30,30,"[' ( DOMINIC listens to the scanner . )', ' [[Dispatch]] victor 9 , victor 9 , report to summit high school , prairie road', ' [[Dispatch]] repeat -- prairie road', ' [[Dispatch]] reported bomb outside classroom 22b , in locker 897', ' ( DOMINIC grabs his jacket , puts it on and leaves the house . )', ' ( The DISPATCH continues . )', ' [[Dispatch]] bomb is trigger-activated and motion-delayed', ' [[Dispatch]] do not handle']",0,None,no dialogue,"[' ( DOMINIC listens to the scanner . )', ' [[Dispatch]] victor 9 , victor 9 , report to summit high school , prairie road', ' [[Dispatch]] repeat -- prairie road', ' [[Dispatch]] reported bomb outside classroom 22b , in locker 897', ' ( DOMINIC grabs his jacket , puts it on and leaves the house . )', ' ( The DISPATCH continues . )', ' [[Dispatch]] bomb is trigger-activated and motion-delayed', ' [[Dispatch]] do not handle']",0.9218981266021729,0.748320996761322,0.5769227743148804,0.10240970551967621,0.08365186303853989,0.06177590414881706,0.033551864326000214,0.030017949640750885,0.022583315148949623,0.09757193922996521,0.16870324313640594,0.2038961499929428,0.1114552766084671,0.15992499887943268,0.09550358355045319,0.3623906373977661,0.0545530766248703,0.03803126513957977,0.45928955078125,0.9081136584281921,0.7089433670043945,0.3816887140274048,0.9968101382255554,0.1070944219827652,0.36011090874671936,0.21180561184883118,0.17642371356487274,0.5215338468551636,0.3266654908657074,0.12205476313829422,0.36769673228263855,0.052601929754018784,0.04515683278441429,0.14224793016910553,0.2158193290233612,0.08272749930620193,0.2910248041152954,0.5327884554862976,0.12463508546352386,0.4114505648612976,0.7035499215126038,0.36566758155822754,0.44280725717544556,0.18330782651901245,0.04895610734820366,0.0347151905298233,0.05608193576335907,0.04153669998049736,0.07020927220582962,0.27667734026908875,0.143809512257576,0.20583747327327728,0.9967536330223083,0.06231841444969177,0.6524645090103149,0.21680666506290436,0.24270404875278473,0.044420626014471054,0.8033747673034668,0.7431213855743408,0.2996986508369446,0.6200307011604309,0.5345301628112793,0.05770550295710564,0.07316884398460388,0.9789226055145264,0.9826071858406067,0.5910026847259388,1,1.0,1.0
25,25,"[' ( CATHERINE walks up the pathway and up to the front door where she cuts the tape to the house . )', ' ( Cut to : In the bedroom , CATHERINE peels back the sheets and checks the bed . )', ' ( Cut to : In the living room , CATHERINE checks the sofa and under the cushions . )', ' ( She stops and looks around . )', ' ( From the curtains , to the fireplace and on to the other curtains where she definitely notices something . )', ' ( CATHERINE takes out the autopsy photographs and looks at the cord used to tie back the curtains . )', "" ( She compares it with the markings found around KRISTY 'S neck . )"", "" ( She 's found the murder weapon . )""]",0,None,no dialogue,"[' ( CATHERINE walks up the pathway and up to the front door where she cuts the tape to the house . )', ' ( Cut to : In the bedroom , CATHERINE peels back the sheets and checks the bed . )', ' ( Cut to : In the living room , CATHERINE checks the sofa and under the cushions . )', ' ( She stops and looks around . )', ' ( From the curtains , to the fireplace and on to the other curtains where she definitely notices something . )', ' ( CATHERINE takes out the autopsy photographs and looks at the cord used to tie back the curtains . )',  ( She compares it with the markings found around KRISTY 'S neck . ),  ( She 's found the murder weapon . )]",0.9218981266021729,0.748320996761322,0.5769227743148804,0.10240970551967621,0.08365186303853989,0.06177590414881706,0.033551864326000214,0.030017949640750885,0.022583315148949623,0.09757193922996521,0.16870324313640594,0.2038961499929428,0.1114552766084671,0.15992499887943268,0.09550358355045319,0.3623906373977661,0.0545530766248703,0.03803126513957977,0.45928955078125,0.9081136584281921,0.7089433670043945,0.3816887140274048,0.9968101382255554,0.1070944219827652,0.36011090874671936,0.21180561184883118,0.17642371356487274,0.5215338468551636,0.3266654908657074,0.12205476313829422,0.36769673228263855,0.052601929754018784,0.04515683278441429,0.14224793016910553,0.2158193290233612,0.08272749930620193,0.2910248041152954,0.5327884554862976,0.12463508546352386,0.4114505648612976,0.7035499215126038,0.36566758155822754,0.44280725717544556,0.18330782651901245,0.04895610734820366,0.0347151905298233,0.05608193576335907,0.04153669998049736,0.07020927220582962,0.27667734026908875,0.143809512257576,0.20583747327327728,0.9967536330223083,0.06231841444969177,0.6524645090103149,0.21680666506290436,0.24270404875278473,0.044420626014471054,0.8033747673034668,0.7431213855743408,0.2996986508369446,0.6200307011604309,0.5345301628112793,0.05770550295710564,0.07316884398460388,0.9789226055145264,0.9826071858406067,0.46198724915044254,1,1.0,1.0
27,27,"[' ( NICK paces the floor . )', ' ( CATHERINE walks in )', ' [[Nick]] well ?', ' [[Catherine]] i think that you and i should head over to the police station', "" [[Nick]] dna did n't pan out , huh ?"", ' [[Catherine]] never have i seen such a clean match', ' [[Catherine]] jack willman killed her', "" ( Quick flashback to : That night in KRISTY 'S living room , JACK WILLMAN has the cord tied tight around her neck and chokes her . )"", ' ( She struggles . )', "" ( Cut to : After KRISTY 'S dead , he unwraps the cord from her neck . )"", ' ( Cut to : He puts the cord back around the curtain )', ' ( End of flashback . )', ' ( Resume to present . )', ' ( NICK sighs . )', ' [[Nick]] thank you', ' ( He hugs CATHERINE . )', "" [[Catherine]] hey ... hey , i 'm just doing my job"", "" [[Catherine]] besides , if they 'd sent you to jail i 'd get stuck with all your cases"", ' ( NICK laughs . )']",1,None,"['[[Nick]] well ?\', \' [[Catherine]] i think that you and i should head over to the police station\', "" [[Nick]] dna did n\'t pan out , huh ?"",', '[[Catherine]] never have i seen such a clean match\', \' [[Catherine]] jack willman killed her\', "" ( Quick flashback to : That night in KRISTY \'S living room , JACK WILLMAN has the cord tied tight around her neck and chokes her . )"",', '[[Nick]] thank you\', \' ( He hugs CATHERINE . )\', "" [[Catherine]] hey ... hey , i \'m just doing my job"",', '[[Catherine]] besides , if they \'d sent you to jail i \'d get stuck with all your cases"",']","[' ( NICK paces the floor . )', ' ( CATHERINE walks in )', '  '  ' ( She struggles . )',  ( Cut to : After KRISTY 'S dead , he unwraps the cord from her neck . ), ' ( Cut to : He puts the cord back around the curtain )', ' ( End of flashback . )', ' ( Resume to present . )', ' ( NICK sighs . )', '    ' ( NICK laughs . )']",0.304833322763443,0.5402527451515198,0.9728252291679382,0.9029453992843628,0.9767769575119019,0.9894961714744568,0.07488548755645752,0.044190872460603714,0.6751785278320312,0.9967877864837646,0.08955466002225876,0.9869627356529236,0.9784001111984253,0.07597676664590836,0.18916380405426025,0.991425096988678,0.3250066637992859,0.5028631687164307,0.6625455617904663,0.5924280881881714,0.6899166703224182,0.04611304774880409,0.16857270896434784,0.180544912815094,0.04245654493570328,0.2593950033187866,0.8846794962882996,0.9871860146522522,0.9962689280509949,0.7556635737419128,0.2870340645313263,0.6782441735267639,0.07938702404499054,0.9888817667961121,0.022711314260959625,0.09298407286405563,0.993909478187561,0.982171356678009,0.9964486956596375,0.9926814436912537,0.13425424695014954,0.07396063208580017,0.36176279187202454,0.3490988612174988,0.678257942199707,0.8760136961936951,0.9921755194664001,0.9823811650276184,0.7994315028190613,0.2184278666973114,0.5533737540245056,0.22073352336883545,0.039584238082170486,0.9898450374603271,0.9932815432548523,0.9862561821937561,0.6620846390724182,0.9915252923965454,0.877465546131134,0.8356661200523376,0.09822791069746017,0.9029403924942017,0.9777421355247498,0.006274879910051823,0.9895513653755188,0.353119432926178,0.3141007721424103,0.7964101340410931,1,0.9999450134211241,0.9999450134211241
32,32,"["" ( O'RILEY escorts JACK WILLMAN down the hallway . )"", ' ( CATHERINE and NICK walk in )', ' [[Nick]] hi', ' [[Nick]] just the guy i wanted to see', "" ( O'RILEY puts a hand on NICK to stop him from getting any closer . )"", "" [[Catherine]] o'riley"", ' ( CATHERINE shakes her head and they both step aside . )', ' [[Nick]] tell me why you did it', ' [[Jack_Willman]] i got nothing to say to you , cowboy', ' ( NICK grabs JACK and pushes his back up against the wall . )', ' [[Nick]] she was going back to college , turning her life around getting out of the business , and you killed her for it !', ' [[Nick]] why ?', ' [[Jack_Willman]] is that what she told you ?', ' [[Jack_Willman]] she was getting out of the business ?', ' [[Jack_Willman]] she was going to college to recruit more girls', "" [[Nick]] do you think i 'm going to believe the john that killed her ?"", ' [[Jack_Willman]] oh , you think i was her client ?', ' [[Jack_Willman]] i was her pimp', ' [[Jack_Willman]] she was leaving me to start her own racket', ' [[Jack_Willman]] so wake up', "" [[Jack_Willman]] this is n't pretty woman"", "" [[Jack_Willman]] she 's not julia roberts"", "" [[Jack_Willman]] you 're not richard gere"", ' ( JACK takes a step aside , NICK grabs him and pushes him back up against the wall . )', ' [[Nick]] yeah , yeah , yeah', "" [[Nick]] i guess you 're right"", "" [[Nick]] because there 's no happy ending for you"", ' [[Nick]] twenty-five to life', ' [[Catherine]] get him out of here', "" ( O'RILEY steps forward . )""]",1,Motive,"['[[Nick]] hi\', \' [[Nick]] just the guy i wanted to see\', "" ( O\'RILEY puts a hand on NICK to stop him from getting any closer . )"",', '[[Catherine]] o\'riley"",', '[[Nick]] tell me why you did it\', \' [[Jack_Willman]] i got nothing to say to you , cowboy\', \' ( NICK grabs JACK and pushes his back up against the wall . )\', \' [[Nick]] she was going back to college , turning her life around getting out of the business , and you killed her for it !\', \' [[Nick]] why ?\', \' [[Jack_Willman]] is that what she told you ?\', \' [[Jack_Willman]] she was getting out of the business ?\', \' [[Jack_Willman]] she was going to college to recruit more girls\', "" [[Nick]] do you think i \'m going to believe the john that killed her ?"",', '[[Jack_Willman]] oh , you think i was her client ?\', \' [[Jack_Willman]] i was her pimp\', \' [[Jack_Willman]] she was leaving me to start her own racket\', \' [[Jack_Willman]] so wake up\', "" [[Jack_Willman]] this is n\'t pretty woman"",', '[[Jack_Willman]] she \'s not julia roberts"",', '[[Jack_Willman]] you \'re not richard gere"",', '[[Nick]] yeah , yeah , yeah\', "" [[Nick]] i guess you \'re right"",', '[[Nick]] because there \'s no happy ending for you"",']","[ ( O'RILEY escorts JACK WILLMAN down the hallway . ), ' ( CATHERINE and NICK walk in )', '    ' ( CATHERINE shakes her head and they both step aside . )', '  '      ' ( JACK takes a step aside , NICK grabs him and pushes him back up against the wall . )', '    ' [[Nick]] twenty-five to life', ' [[Catherine]] get him out of here',  ( O'RILEY steps forward . )]",0.6233329772949219,0.8656212687492371,0.372122585773468,0.9457295536994934,0.9818130135536194,0.9923908710479736,0.333184152841568,0.2731287479400635,0.8258273601531982,0.9954376816749573,0.47911354899406433,0.9775987863540649,0.843702495098114,0.2574997842311859,0.4298833906650543,0.9568671584129333,0.2292969822883606,0.37240681052207947,0.9190786480903625,0.6568723320960999,0.7134915590286255,0.17873238027095795,0.4441128969192505,0.5835252404212952,0.535606861114502,0.7666232585906982,0.9301164746284485,0.9695829749107361,0.9932431578636169,0.8901799917221069,0.2523285150527954,0.7989497780799866,0.41716960072517395,0.9842101335525513,0.5495280027389526,0.09686384350061417,0.9873093962669373,0.9819520711898804,0.9945140480995178,0.9783312678337097,0.4861849248409271,0.616889476776123,0.6457847356796265,0.2407458871603012,0.8661108613014221,0.9394571781158447,0.9927522540092468,0.9879322052001953,0.9173711538314819,0.7781292796134949,0.8459758162498474,0.6543717980384827,0.31519433856010437,0.9644901752471924,0.9841939210891724,0.9669700264930725,0.887383759021759,0.9874548316001892,0.7850449085235596,0.8794268369674683,0.19812771677970886,0.4602365791797638,0.5247789025306702,0.17760929465293884,0.9685381650924683,0.8090640306472778,0.7706318497657776,0.9453323227608016,1,0.9966236774261472,0.9966236774261472
33,33,"[' ( GRISSOM eats his dinner and reads the front page of the paper . )', ' ( He looks at it , then smiles . )', ' [[Grissom]] above the fold', ' ( He tears out the article . )', "" ( Cut to : Out in the hallway , GRISSOM pins the article onto the bulletin board , above the section , 'ONE OF OUR OWN ' . )"", ' ( The article headline reads : LOCAL HERO GIVES HIS LIFE . )', "" ( There 's a photo of DOMINIC KRETZKER on the right with the caption : 'Dominic Kretzker Saves Summit High Students ' . )"", "" ( The caption under the headline reads : 'Dominic Kretzker sacrificed his life today for the students of Summit High School . )"", ' ( The article was written by Marilyn Mancia , Staff Writer . )', ' ( GRISSOM walks away . )', ' ( The camera slowly pushes into the article and the photo of DOMINIC . )']",0,None,"['[[Grissom]] above the fold\', \' ( He tears out the article . )\', "" ( Cut to : Out in the hallway , GRISSOM pins the article onto the bulletin board , above the section , \'ONE OF OUR OWN \' . )"",']","[' ( GRISSOM eats his dinner and reads the front page of the paper . )', ' ( He looks at it , then smiles . )', '  ' ( The article headline reads : LOCAL HERO GIVES HIS LIFE . )',  ( There 's a photo of DOMINIC KRETZKER on the right with the caption : 'Dominic Kretzker Saves Summit High Students ' . ),  ( The caption under the headline reads : 'Dominic Kretzker sacrificed his life today for the students of Summit High School . ), ' ( The article was written by Marilyn Mancia , Staff Writer . )', ' ( GRISSOM walks away . )', ' ( The camera slowly pushes into the article and the photo of DOMINIC . )']",0.6652190685272217,0.4697640836238861,0.12417981028556824,0.273256778717041,0.18802860379219055,0.10029297322034836,0.03427188843488693,0.025770016014575958,0.2521510720252991,0.48120856285095215,0.08673547953367233,0.910991370677948,0.8187636733055115,0.0205252543091774,0.08107145875692368,0.14959660172462463,0.05602646991610527,0.03548499941825867,0.9917421340942383,0.9465580582618713,0.8449262380599976,0.26932814717292786,0.4836725890636444,0.03373844549059868,0.09211160242557526,0.44075074791908264,0.12185854464769363,0.16436409950256348,0.14283387362957,0.1974194347858429,0.3517201542854309,0.0762845128774643,0.007863473147153854,0.06336410343647003,0.5293536186218262,0.2773522138595581,0.6098161339759827,0.3707588016986847,0.24640223383903503,0.27477383613586426,0.6502476334571838,0.27891117334365845,0.5453582406044006,0.11546500027179718,0.03862752765417099,0.07040762901306152,0.059526409953832626,0.1624862551689148,0.23494689166545868,0.5475813746452332,0.23073317110538483,0.23733434081077576,0.00036530353827401996,0.15059806406497955,0.965446412563324,0.5107282996177673,0.9624800086021423,0.3577767312526703,0.5185298323631287,0.3979052007198334,0.21004922688007355,0.06578541547060013,0.05974153056740761,0.019641101360321045,0.4776637554168701,0.9935804009437561,0.3329504430294037,0.6248232647977133,1,0.9920546592987582,0.9920546592987582
8,8,"[' ( NICK is driving and talking on his cell phone . )', "" [[Nick]] hey , it 's me"", ' [[Nick]] you in the shower ?', ' [[Nick]] what are you doing ?', "" [[Nick]] anyway , if you check your messages i do n't have to work till later"", "" [[Nick]] so i thought , since you 're between careers you might want to grab a late"", "" ( NICK pulls up in front of KRISTY HOPKINS ' house and finds it surrounded by officer cars . )"", ' [[Nick]] ... breakfast', ' ( He pulls up . )', ' ( OFFICER ARVINGTON sees him . )', "" [[Officer_Arvington]] hey , nick , what 's up ?"", ' [[Nick]] not a lot', "" [[Nick]] what 's ... what 's going on ?"", "" [[Officer_Arvington]] it 's a 419"", ' [[Officer_Arvington]] dead prostitute', "" [[Nick]] who 's the decedent ?"", ' [[Officer_Arvington]] kristine marie hopkins', "" [[Officer_Arvington]] day shift 's got it covered"", ' [[Officer_Arvington]] you all right ?', "" ( NICK looks over and sees ECKLIE talking with the LEAD DETECTIVE and they 're both walking down the driveway . )"", "" [[Nick]] yeah , i must 've , uh"", "" [[Nick]] i must 've got my wires crossed"", "" [[Nick]] i 'll see you"", ' [[Officer_Arvington]] all right , man', ' ( NICK drives off . )']",1,Crime scene,"['[[Nick]] hey , it \'s me"",', '[[Nick]] you in the shower ?\', \' [[Nick]] what are you doing ?\', "" [[Nick]] anyway , if you check your messages i do n\'t have to work till later"",', '[[Nick]] so i thought , since you \'re between careers you might want to grab a late"",', '[[Nick]] ... breakfast\', \' ( He pulls up . )\', \' ( OFFICER ARVINGTON sees him . )\', "" [[Officer_Arvington]] hey , nick , what \'s up ?"",', '[[Nick]] not a lot\', "" [[Nick]] what \'s ... what \'s going on ?"",', '[[Officer_Arvington]] it \'s a 419"",', '[[Officer_Arvington]] dead prostitute\', "" [[Nick]] who \'s the decedent ?"",', '[[Officer_Arvington]] kristine marie hopkins\', "" [[Officer_Arvington]] day shift \'s got it covered"",', '[[Officer_Arvington]] you all right ?\', "" ( NICK looks over and sees ECKLIE talking with the LEAD DETECTIVE and they \'re both walking down the driveway . )"",', '[[Nick]] yeah , i must \'ve , uh"",', '[[Nick]] i must \'ve got my wires crossed"",', '[[Nick]] i \'ll see you"",']","[' ( NICK is driving and talking on his cell phone . )',   '     ( NICK pulls up in front of KRISTY HOPKINS ' house and finds it surrounded by officer cars . ), '  '    '  '  '        ' [[Officer_Arvington]] all right , man', ' ( NICK drives off . )']",0.18011286854743958,0.1494012326002121,0.1080547422170639,0.23872557282447815,0.23553214967250824,0.5637021064758301,0.10437405854463577,0.059071335941553116,0.8062047958374023,0.9157170057296753,0.06245489418506622,0.5375474691390991,0.8775644302368164,0.026362953707575798,0.28406354784965515,0.7858890891075134,0.07537782937288284,0.049769140779972076,0.2646075189113617,0.6721013784408569,0.6010873317718506,0.06733828783035278,0.07232264429330826,0.07030115276575089,0.09278294444084167,0.08919615298509598,0.13721947371959686,0.13946983218193054,0.9935323596000671,0.11876769363880157,0.1423608362674713,0.16917061805725098,0.802393913269043,0.89371657371521,0.06828422844409943,0.027183065190911293,0.5997689962387085,0.8449887633323669,0.8221246004104614,0.6708243489265442,0.1109553650021553,0.1291109025478363,0.17414189875125885,0.051733702421188354,0.3639647960662842,0.7383233308792114,0.8450448513031006,0.622466504573822,0.43620988726615906,0.32897377014160156,0.4395431578159332,0.18036827445030212,0.009880272671580315,0.5503349900245667,0.8918803334236145,0.4360925555229187,0.20998960733413696,0.34561631083488464,0.41166952252388,0.4040394127368927,0.0628032386302948,0.11627615988254547,0.09721777588129044,0.019833020865917206,0.625427782535553,0.27359649538993835,0.13638728857040405,0.18624415356080415,1,0.9919364748118946,0.9919364748118946
