,scene_id,scene_text,in_summary,aspects,dialogue,non_dialogue,annihilate,annihilation,asphyxiate,assassin,assassinate,assassination,behead,beheading,blood-bath,bloodshed,butcher,butchery,carnage,crucifixion,crucify,deadly,decapitate,decapitation,destroy,dispatch,do in,drown,eliminate,euthanasia,euthanize,exterminate,extermination,fatal,fatality,fratricide,garrotte,genocide,holocaust,homicide,immolation,infanticide,kill,killer,killing,lethal,liquidate,liquidation,liquidator,lynch,massacre,matricide,murder,murderer,patricide,pogrom,regicide,shooting,silence,slaughter,slaughterer,slay,slayer,slaying,smother,smothering,starve,suffocate,suffocation,suicide,take (someone)life,take out,terminate,centrality,prediction_class,score,combined_score
4,4,"[' ( NICK and his friend , ERIC , walk through the hotel toward the front door . )', ' [[Eric]] come on , nick', "" [[Eric]] it 's my last night in sin city"", ' [[Eric]] one more drink , man', ' [[Nick]] oh , no', ' [[Nick]] i just pulled a double and i still have to file my shift report', ' ( NICK hands the valet his ticket . )', "" [[Eric]] hey , you 're off the clock"", "" [[Eric]] you 'd have never passed up a wild night back at aandm"", ' [[Nick]] well , i guess i grew up', ' [[Eric]] too bad', ' [[Eric]] check that out', ' ( ERIC indicates the two women walking down the sidewalk toward the building . )', ' ( He looks at them as they walk inside . )', ' ( They look at him as they walk by . )', ' [[Nick]] enjoy', ' ( They shake hands . )', ' [[Eric]] you must really love your job , man', ' ( ERIC turns and round and calls out to the two women who just walked by . )', ' ( They turn around as he approaches them . )', ' [[Eric]] ladies', ' ( NICK chuckles , then turns to leave . )', "" ( The valet brings NICK 'S car up to the drive . )"", "" ( NICK reaches into his pocket for the tip and walks over to the driver 's side . )"", ' [[Nick]] here you go', ' [[Nick]] thanks , man', ' [[Valet]] thank you', ' ( NICK is just about to get into the car , when he hears a disturbance off in the distance . )', ' [[Kristy_Hopkins]] get your hands off me !', ' [[Kristy_Hopkins]] let go of me', "" [[Kristy_Hopkins]] you do n't own me"", ' [[Kristy_Hopkins]] nobody does', "" [[Jack_Willman]] you 're not going anywhere"", ' [[Jack_Willman]] you got that ?', ' ( NICK looks up and sees KRISTY HOPKINS arguing with a man who has his hand grasping her upper arm . )', ' [[Jack_Willman]] come on', ' [[Jack_Willman]] relax a little bit', ' [[Jack_Willman]] settle down', ' ( NICK heads over to them . )', ' [[Nick]] kristy ?', "" [[Kristy_Hopkins]] you do n't own me , jack"", ' ( NICK starts to cross the street . )', ' [[Nick]] kristy !', ' [[Kristy_Hopkins]] nobody does', ' [[Jack_Willman]] i know , i know', ' ( NICK finally reaches them and stops a distance away from them . )', ' ( He gets their attention . )', ' [[Nick]] hey', ' [[Nick]] back off', ' [[Jack]] hey , just mind your own business', ' [[Kristy_Hopkins]] nick', ' ( JACK tries to shush her . )', ' [[Kristy_Hopkins]] i know him', "" [[Kristy_Hopkins]] he 's a cop"", ' [[Nick]] crime scene investigator', ' [[Kristy_Hopkins]] nick , tell him to leave me alone', ' [[Jack_Willman]] nobody tells me to do anything', ' [[Nick]] hey , we going to have a problem ?', "" [[Jack_Willman]] no , officer , we 're not going to have a problem"", ' [[Jack_Willman]] see you around , baby', ' ( He kisses her on the neck , then lets her go . )', ' ( He leaves . )', ' ( KRISTY appears to be slightly rattled . )', ' ( NICK looks at her and notices . )', ' [[Nick]] you okay ?', ' [[Kristy_Hopkins]] yeah', "" [[Kristy_Hopkins]] yeah , i 'm fine"", ' [[Kristy_Hopkins]] that was good timing', ' [[Kristy_Hopkins]] thanks', ' [[Nick]] i suppose you need a ride', ' [[Kristy_Hopkins]] do you mind ?', ' [[Nick]] no', ' [[Nick]] come on', ' [[Kristy_Hopkins]] thanks']",1,"Victim,Perpetrator","['[[Eric]] come on , nick\', "" [[Eric]] it \'s my last night in sin city"",', '[[Eric]] one more drink , man\', \' [[Nick]] oh , no\', \' [[Nick]] i just pulled a double and i still have to file my shift report\', \' ( NICK hands the valet his ticket . )\', "" [[Eric]] hey , you \'re off the clock"",', '[[Eric]] you \'d have never passed up a wild night back at aandm"",', '[[Nick]] well , i guess i grew up\', \' [[Eric]] too bad\', \' [[Eric]] check that out\', \' ( ERIC indicates the two women walking down the sidewalk toward the building . )\', \' ( He looks at them as they walk inside . )\', \' ( They look at him as they walk by . )\', \' [[Nick]] enjoy\', \' ( They shake hands . )\', \' [[Eric]] you must really love your job , man\', \' ( ERIC turns and round and calls out to the two women who just walked by . )\', \' ( They turn around as he approaches them . )\', \' [[Eric]] ladies\', \' ( NICK chuckles , then turns to leave . )\', "" ( The valet brings NICK \'S car up to the drive . )"",', '[[Nick]] here you go\', \' [[Nick]] thanks , man\', \' [[Valet]] thank you\', \' ( NICK is just about to get into the car , when he hears a disturbance off in the distance . )\', \' [[Kristy_Hopkins]] get your hands off me !\', \' [[Kristy_Hopkins]] let go of me\', "" [[Kristy_Hopkins]] you do n\'t own me"",', '[[Kristy_Hopkins]] nobody does\', "" [[Jack_Willman]] you \'re not going anywhere"",', '[[Jack_Willman]] you got that ?\', \' ( NICK looks up and sees KRISTY HOPKINS arguing with a man who has his hand grasping her upper arm . )\', \' [[Jack_Willman]] come on\', \' [[Jack_Willman]] relax a little bit\', \' [[Jack_Willman]] settle down\', \' ( NICK heads over to them . )\', \' [[Nick]] kristy ?\', "" [[Kristy_Hopkins]] you do n\'t own me , jack"",', '[[Nick]] kristy !\', \' [[Kristy_Hopkins]] nobody does\', \' [[Jack_Willman]] i know , i know\', \' ( NICK finally reaches them and stops a distance away from them . )\', \' ( He gets their attention . )\', \' [[Nick]] hey\', \' [[Nick]] back off\', \' [[Jack]] hey , just mind your own business\', \' [[Kristy_Hopkins]] nick\', \' ( JACK tries to shush her . )\', \' [[Kristy_Hopkins]] i know him\', "" [[Kristy_Hopkins]] he \'s a cop"",', '[[Nick]] crime scene investigator\', \' [[Kristy_Hopkins]] nick , tell him to leave me alone\', \' [[Jack_Willman]] nobody tells me to do anything\', \' [[Nick]] hey , we going to have a problem ?\', "" [[Jack_Willman]] no , officer , we \'re not going to have a problem"",', '[[Jack_Willman]] see you around , baby\', \' ( He kisses her on the neck , then lets her go . )\', \' ( He leaves . )\', \' ( KRISTY appears to be slightly rattled . )\', \' ( NICK looks at her and notices . )\', \' [[Nick]] you okay ?\', \' [[Kristy_Hopkins]] yeah\', "" [[Kristy_Hopkins]] yeah , i \'m fine"",']","[' ( NICK and his friend , ERIC , walk through the hotel toward the front door . )', '  '    '   ( NICK reaches into his pocket for the tip and walks over to the driver 's side . ), '  '  '  ' ( NICK starts to cross the street . )', '  '  '  ' [[Kristy_Hopkins]] that was good timing', ' [[Kristy_Hopkins]] thanks', ' [[Nick]] i suppose you need a ride', ' [[Kristy_Hopkins]] do you mind ?', ' [[Nick]] no', ' [[Nick]] come on', ' [[Kristy_Hopkins]] thanks']",0.823813796043396,0.823760449886322,0.9473402500152588,0.8960448503494263,0.807841956615448,0.8964143991470337,0.9624201655387878,0.8126547336578369,0.5489556789398193,0.9478676915168762,0.8064115047454834,0.9410839676856995,0.8860913515090942,0.9203577041625977,0.8669919371604919,0.9338693618774414,0.9011420011520386,0.9455956816673279,0.8674260973930359,0.8895299434661865,0.967405378818512,0.9098128080368042,0.9395434260368347,0.7773754596710205,0.6258935332298279,0.8448442816734314,0.8283642530441284,0.8053159713745117,0.8474852442741394,0.7647088170051575,0.8328621983528137,0.8538945913314819,0.9249321818351746,0.9519867300987244,0.9134991765022278,0.9232345819473267,0.9211500287055969,0.9309287667274475,0.8953802585601807,0.9123119115829468,0.9012756943702698,0.9110926389694214,0.9344048500061035,0.7875499129295349,0.7128628492355347,0.8982287049293518,0.9472900629043579,0.8512314558029175,0.8480846881866455,0.8884382247924805,0.9485233426094055,0.9335787892341614,0.9212979078292847,0.9162783026695251,0.8936271667480469,0.9613025188446045,0.9249405264854431,0.9345393776893616,0.9136432409286499,0.9424762725830078,0.8984395265579224,0.8774245977401733,0.9269731640815735,0.642715334892273,0.9554135799407959,0.9654214382171631,0.9511561989784241,0.07528423193851208,0,0.9276625894485009,0.9276625894485009
24,24,"[' ( In the garage , NORMAL STIRLING tinkers with his car while his son , TYLER , sweeps the floors . )', ' ( BRASS , SARA and a couple of officers walk up the driveway . )', ' [[Brass]] norman stirling ?', ' [[Norman_Stirling]] yes', "" [[Norman_Stirling]] what 's going on ?"", "" [[Sara]] 'fp '"", ' [[Norman_Stirling]] what ?', "" [[Sara]] you do n't recognize those initials ?"", ' ( Behind him , a couple of officers come in through the doorway from the house . )', "" [[Norman_Stirling]] what 's this about ?"", ' [[Brass]] the bombing of the thrift-right car rental and the bombing of the hansen building', ' [[Norman_Stirling]] a-a bomb ?', ' [[Norman_Stirling]] are you kidding ?', "" [[Norman_Stirling]] i 've never even been near a bomb my entire life"", ' [[Sara]] well , those orange jackets over there appear to match the materials the bombs were wrapped in', ' [[Norman_Stirling]] i used to wear those to go to work', ' [[Brass]] you were let go by thriftrright last year , and lost a court battle to get your job back', ' [[Brass]] in fact , they filed a tro against you for throwing furniture around their headquarters last july', ' [[Norman_Stirling]] i want to call my lawyer', ' [[Brass]] good', ' [[Brass]] you can call him from the car', ' [[Brass]] he can meet us at the pd', "" [[Brass]] take him in come on , let 's go"", ' ( BRASS takes a hold of NORMAL STIRLING and the OFFICERS put cuffs on him . )', ' [[Norman_Stirling]] call your mom']",1,Perpetrator,"['[[Brass]] norman stirling ?\', \' [[Norman_Stirling]] yes\', "" [[Norman_Stirling]] what \'s going on ?"",', '[[Sara]] \'fp \'"",', '[[Norman_Stirling]] what ?\', "" [[Sara]] you do n\'t recognize those initials ?"",', '[[Norman_Stirling]] what \'s this about ?"",', '[[Brass]] the bombing of the thrift-right car rental and the bombing of the hansen building\', \' [[Norman_Stirling]] a-a bomb ?\', \' [[Norman_Stirling]] are you kidding ?\', "" [[Norman_Stirling]] i \'ve never even been near a bomb my entire life"",', '[[Sara]] well , those orange jackets over there appear to match the materials the bombs were wrapped in\', \' [[Norman_Stirling]] i used to wear those to go to work\', \' [[Brass]] you were let go by thriftrright last year , and lost a court battle to get your job back\', \' [[Brass]] in fact , they filed a tro against you for throwing furniture around their headquarters last july\', \' [[Norman_Stirling]] i want to call my lawyer\', \' [[Brass]] good\', \' [[Brass]] you can call him from the car\', \' [[Brass]] he can meet us at the pd\', "" [[Brass]] take him in come on , let \'s go"",']","[' ( In the garage , NORMAL STIRLING tinkers with his car while his son , TYLER , sweeps the floors . )', ' ( BRASS , SARA and a couple of officers walk up the driveway . )', '    '  ' ( Behind him , a couple of officers come in through the doorway from the house . )',   '  '  ' ( BRASS takes a hold of NORMAL STIRLING and the OFFICERS put cuffs on him . )', ' [[Norman_Stirling]] call your mom']",0.3455379605293274,0.263243705034256,0.16841748356819153,0.22212739288806915,0.30052831768989563,0.40242210030555725,0.09884602576494217,0.0987958237528801,0.601717472076416,0.9310036897659302,0.12383895367383957,0.4951605200767517,0.7781565189361572,0.12464287877082825,0.554980993270874,0.7913678884506226,0.18746055662631989,0.1667284071445465,0.7392449378967285,0.9610192775726318,0.852128803730011,0.46506211161613464,0.18398796021938324,0.050879016518592834,0.04822066053748131,0.2836172580718994,0.2559208869934082,0.4258522093296051,0.2144124060869217,0.2621223032474518,0.24726977944374084,0.1283470243215561,0.1393127292394638,0.19429560005664825,0.24536395072937012,0.07306641340255737,0.5415999293327332,0.8958634734153748,0.6918033957481384,0.8246836066246033,0.3223803639411926,0.42400261759757996,0.4394034445285797,0.05502963811159134,0.17633609473705292,0.23257331550121307,0.2066231220960617,0.08971866220235825,0.30211779475212097,0.7311546802520752,0.3365093469619751,0.48081082105636597,0.06320318579673767,0.3819010853767395,0.6774431467056274,0.7247553467750549,0.4132911264896393,0.5926863551139832,0.5820013880729675,0.8795114159584045,0.5738895535469055,0.4242395758628845,0.38426673412323,0.05061547830700874,0.7484242916107178,0.5670180320739746,0.541679322719574,0.6626202817464552,0,0.9119524106556072,0.9119524106556072
10,10,"["" ( SARA looks at all the bomb pieces they 've gathered spread out on the table in front of them . )"", ' ( CATHERINE explains it to her . )', ' [[Sara]] so all this stuff is from a five-meter radius of the point of origin ?', ' [[Catherine]] yep', ' [[Sara]] how could the victim possibly have been in one piece ?', ' [[Catherine]] vacuum effect', ' [[Catherine]] the air is being pushed out so fast', ' ( Quick CGI to : The hands of the clock hit 12 , the electrical pulse is sent through the wires and to the gunpowder where it ignites . )', ' [[Catherine]] ... when the bomb detonates', ' ( End of CGI . )', ' ( White flash to the moment where JAKE RICHARDS leans down to pick up the suitcase . )', ' ( Everything stops in that moment as the bomb explodes . )', "" [[Catherine]] ... there 's a calm at the center"", ' ( The bomb explodes and everything and everyone is pushed away . )', ' ( End of flashback . )', ' ( Resume to present . )', ' ( SARA looks down at the items on the table and picks up the gear piece with the etching on it . )', ' [[Sara]] calm , huh ?', ' [[Catherine]] well , except for when he lost his ears', "" [[Sara]] did you figure out what this 'fp ' stands for ?"", "" [[Catherine]] i ran it through atf 's bomb database"", ' [[Catherine]] no profile', "" [[Sara]] so our bomber 's a newbie"", "" [[Sara]] does he fit grissom 's wack job from the bomb site ?"", ' [[Catherine]] dominic the security guard ?', "" [[Catherine]] it 's too soon to tell"", ' ( GRISSOM walks in carrying something . )', ' ( He holds it out for them to look ati . )', ' [[Grissom]] i found something interesting', ' [[Sara]] what is it ?', ' ( CATHERINE looks at it under the glass . )', ' [[Catherine]] looks like a balance wheel from a clock', ' [[Grissom]] bomb was time-delayed', ' [[Grissom]] this is a piece of the timing device', ' [[Sara]] what about the orange stuff ?', ' [[Grissom]] heat of the explosion must have melted whatever it is all around the wheel', ' [[Grissom]] so , sara ?', ' [[Sara]] mmm ?', "" [[Grissom]] what 's orange and melts ?"", ' [[Sara]] i would have to investigate that', ' [[Grissom]] thank you', ' ( NICK walks into the room . )', ' [[Nick]] hey , guys', ' [[Nick]] can i steal you for a minute ?', ' [[Grissom]] i thought this was your day off', "" [[Catherine]] we 're kind of busy here , nick"", "" [[Nick]] yeah , i know , and i 'm sorry , but i do n't think this can wait"", ' [[Grissom]] okay', ' ( They step out of the lab . )']",1,Evidence,"['[[Sara]] so all this stuff is from a five-meter radius of the point of origin ?\', \' [[Catherine]] yep\', \' [[Sara]] how could the victim possibly have been in one piece ?\', \' [[Catherine]] vacuum effect\', \' [[Catherine]] the air is being pushed out so fast\', \' ( Quick CGI to : The hands of the clock hit 12 , the electrical pulse is sent through the wires and to the gunpowder where it ignites . )\', \' [[Catherine]] ... when the bomb detonates\', \' ( End of CGI . )\', \' ( White flash to the moment where JAKE RICHARDS leans down to pick up the suitcase . )\', \' ( Everything stops in that moment as the bomb explodes . )\', "" [[Catherine]] ... there \'s a calm at the center"",', '[[Sara]] calm , huh ?\', \' [[Catherine]] well , except for when he lost his ears\', "" [[Sara]] did you figure out what this \'fp \' stands for ?"",', '[[Catherine]] i ran it through atf \'s bomb database"",', '[[Catherine]] no profile\', "" [[Sara]] so our bomber \'s a newbie"",', '[[Sara]] does he fit grissom \'s wack job from the bomb site ?"",', '[[Catherine]] dominic the security guard ?\', "" [[Catherine]] it \'s too soon to tell"",', '[[Grissom]] i found something interesting\', \' [[Sara]] what is it ?\', \' ( CATHERINE looks at it under the glass . )\', \' [[Catherine]] looks like a balance wheel from a clock\', \' [[Grissom]] bomb was time-delayed\', \' [[Grissom]] this is a piece of the timing device\', \' [[Sara]] what about the orange stuff ?\', \' [[Grissom]] heat of the explosion must have melted whatever it is all around the wheel\', \' [[Grissom]] so , sara ?\', \' [[Sara]] mmm ?\', "" [[Grissom]] what \'s orange and melts ?"",', '[[Sara]] i would have to investigate that\', \' [[Grissom]] thank you\', \' ( NICK walks into the room . )\', \' [[Nick]] hey , guys\', \' [[Nick]] can i steal you for a minute ?\', \' [[Grissom]] i thought this was your day off\', "" [[Catherine]] we \'re kind of busy here , nick"",', '[[Nick]] yeah , i know , and i \'m sorry , but i do n\'t think this can wait"",']","[ ( SARA looks at all the bomb pieces they 've gathered spread out on the table in front of them . ), ' ( CATHERINE explains it to her . )', '  ' ( The bomb explodes and everything and everyone is pushed away . )', ' ( End of flashback . )', ' ( Resume to present . )', ' ( SARA looks down at the items on the table and picks up the gear piece with the etching on it . )', '    '    '  ' ( GRISSOM walks in carrying something . )', ' ( He holds it out for them to look ati . )', '  '    ' [[Grissom]] okay', ' ( They step out of the lab . )']",0.26271334290504456,0.5547893643379211,0.7144670486450195,0.4973163604736328,0.49963927268981934,0.7142784595489502,0.07847489416599274,0.10249051451683044,0.06862520426511765,0.8059940338134766,0.1384841948747635,0.591524064540863,0.3605649769306183,0.07180523127317429,0.20535637438297272,0.8669835329055786,0.13682270050048828,0.15465426445007324,0.5809374451637268,0.4981846511363983,0.6499654650688171,0.15053023397922516,0.16879263520240784,0.09020771086215973,0.08086985349655151,0.18807566165924072,0.4080153703689575,0.21613755822181702,0.9099504351615906,0.48272061347961426,0.14318333566188812,0.08738792687654495,0.21204832196235657,0.7804396152496338,0.8331297636032104,0.11609703302383423,0.6230483055114746,0.8449073433876038,0.9491317272186279,0.660778284072876,0.20310096442699432,0.4436057209968567,0.2729838192462921,0.15247046947479248,0.26432377099990845,0.5244417786598206,0.8343002796173096,0.4518621265888214,0.5488433837890625,0.45214954018592834,0.36676260828971863,0.36573082208633423,0.23241887986660004,0.22851842641830444,0.46913033723831177,0.34410494565963745,0.38665908575057983,0.38133931159973145,0.4556392431259155,0.7647554278373718,0.2237117886543274,0.411896675825119,0.7385769486427307,0.08126967400312424,0.6262482404708862,0.43865495920181274,0.383450984954834,0.2998081953976993,0,0.882708348546287,0.882708348546287
9,9,"[' ( DOMINIC KRETZKER explains how bombs work to BRASS and WARRICK . )', ' [[Dominic_Kretzker]] all right , you cram this thing here with gunpowder , all right ?', ' [[Dominic_Kretzker]] then you cap it here , and you cap it here', "" [[Dominic_Kretzker]] now the grains inside , all right ... they 're going to ignite and cause smoke"", "" [[Dominic_Kretzker]] lots and lots of smoke ... now , the problem is , all that smoke 's here man it 's got nowhere to go"", ' [[Dominic_Kretzker]] okay ?', "" [[Dominic_Kretzker]] it starts cooking ... and then ... bob 's your uncle ... boom !"", ' [[Warrick]] grissom was right : you do know a lot about bombs', ' [[Brass]] how did you learn so much ?', "" [[Dominic_Kretzker]] oh , they do n't teach this stuff at universities"", ' [[Dominic_Kretzker]] no , this is all trial and error', ' [[Brass]] so what , you just , uh , blow up bombs and study them ?', ' [[Dominic_Kretzker]] yeah', ' [[Dominic_Kretzker]] yeah', "" ( There 's a light knocking on the door . )"", ' ( MARGARET FINN walks in )', ' [[Margaret_Finn]] margaret finn , public defender', ' [[Margaret_Finn]] cease and desist any conversation with my client', "" [[Margaret_Finn]] i 've been assigned to you"", ' [[Margaret_Finn]] guess the pd was thinking of all the lawsuits richard jewell brought when he was wrongfully accused', ' [[Brass]] someone died in that office building', "" [[Dominic_Kretzker]] ma'am , you seem like a very nice person but these people -- they 've been very , very good to me"", "" [[Margaret_Finn]] i 'm sure they have"", ' [[Warrick]] dominic , i think you should go with your attorney', ' [[Warrick]] thanks for your help , though', ' ( DOMINIC nods . )', "" [[Dominic_Kretzker]] all right i 'll see you guys later"", ' ( DOMINIC turns around and shakes their hands . )', ' [[Dominic_Kretzker]] listen , do me a favor', ' [[Dominic_Kretzker]] will you tell grissom that , if he needs me just call me at home , okay ?', ' [[Brass]] all right', ' ( DOMINIC turns around to look at his attorney . )', "" [[Dominic_Kretzker]] let 's roll"", ' ( He leaves the room . )']",0,None,"['[[Dominic_Kretzker]] all right , you cram this thing here with gunpowder , all right ?\', \' [[Dominic_Kretzker]] then you cap it here , and you cap it here\', "" [[Dominic_Kretzker]] now the grains inside , all right ... they \'re going to ignite and cause smoke"",', '[[Dominic_Kretzker]] lots and lots of smoke ... now , the problem is , all that smoke \'s here man it \'s got nowhere to go"",', '[[Dominic_Kretzker]] okay ?\', "" [[Dominic_Kretzker]] it starts cooking ... and then ... bob \'s your uncle ... boom !"",', '[[Warrick]] grissom was right : you do know a lot about bombs\', \' [[Brass]] how did you learn so much ?\', "" [[Dominic_Kretzker]] oh , they do n\'t teach this stuff at universities"",', '[[Dominic_Kretzker]] no , this is all trial and error\', \' [[Brass]] so what , you just , uh , blow up bombs and study them ?\', \' [[Dominic_Kretzker]] yeah\', \' [[Dominic_Kretzker]] yeah\', "" ( There \'s a light knocking on the door . )"",', '[[Margaret_Finn]] margaret finn , public defender\', \' [[Margaret_Finn]] cease and desist any conversation with my client\', "" [[Margaret_Finn]] i \'ve been assigned to you"",', '[[Margaret_Finn]] guess the pd was thinking of all the lawsuits richard jewell brought when he was wrongfully accused\', \' [[Brass]] someone died in that office building\', "" [[Dominic_Kretzker]] ma\'am , you seem like a very nice person but these people -- they \'ve been very , very good to me"",', '[[Margaret_Finn]] i \'m sure they have"",', '[[Warrick]] dominic , i think you should go with your attorney\', \' [[Warrick]] thanks for your help , though\', \' ( DOMINIC nods . )\', "" [[Dominic_Kretzker]] all right i \'ll see you guys later"",', '[[Dominic_Kretzker]] listen , do me a favor\', \' [[Dominic_Kretzker]] will you tell grissom that , if he needs me just call me at home , okay ?\', \' [[Brass]] all right\', \' ( DOMINIC turns around to look at his attorney . )\', "" [[Dominic_Kretzker]] let \'s roll"",']","[' ( DOMINIC KRETZKER explains how bombs work to BRASS and WARRICK . )', '    '  '  '  ' ( MARGARET FINN walks in )', '  '    '  ' ( DOMINIC turns around and shakes their hands . )', '  ' ( He leaves the room . )']",0.19678620994091034,0.29303932189941406,0.43504613637924194,0.2533144950866699,0.18568184971809387,0.20934978127479553,0.10332691669464111,0.04707450792193413,0.32057222723960876,0.8566228747367859,0.18316566944122314,0.3532162010669708,0.7752716541290283,0.10413065552711487,0.3078882396221161,0.9333162903785706,0.10405772179365158,0.09886392205953598,0.6116459369659424,0.4098515808582306,0.8268307447433472,0.17063523828983307,0.18621908128261566,0.09030501544475555,0.05211113393306732,0.17294125258922577,0.17146262526512146,0.8338822722434998,0.935434103012085,0.4279167652130127,0.21449081599712372,0.07359523326158524,0.16905495524406433,0.3742913603782654,0.7382723093032837,0.16470737755298615,0.6106917858123779,0.7691224217414856,0.7354176044464111,0.8981198072433472,0.43420952558517456,0.3950481116771698,0.45519477128982544,0.14577807486057281,0.19970135390758514,0.37937232851982117,0.27360114455223083,0.2528332769870758,0.4196317195892334,0.3974849581718445,0.29383164644241333,0.7107354998588562,0.06702084094285965,0.35596001148223877,0.5089631676673889,0.6008422374725342,0.36150118708610535,0.40280774235725403,0.5760288834571838,0.7728388905525208,0.1072460189461708,0.24294684827327728,0.2312854826450348,0.04463433101773262,0.4773067533969879,0.30419498682022095,0.39121055603027344,0.253842570794207,0,0.8490113999641635,0.8490113999641635
